[
  {
    "id": "research-gr-gaussian",
    "images": [
      {
        "url": "/assets/gr-gaussian-fig-4.jpg"
      }
    ],
    "en": {
      "title": "GR-Gaussian: Graph-Based Radiative Gaussian Splatting for Sparse-View Tomographic Reconstruction",
      "descriptionHtml": ""
    },
    "zh": {
      "title": "基于图结构的高斯溅射技术用于稀疏角度CT重建",
      "descriptionHtml": ""
    }
  },
  {
    "id": "research-1",
    "images": [
      {
        "url": "https://pkuaimi.com/wp-content/uploads/2025/11/%E8%84%91%E8%BD%AC%E7%A7%BB%E7%98%A4%E7%9F%A2%E9%87%8F.png"
      }
    ],
    "en": {
      "title": "Brain metastases detection and segmentation",
      "descriptionHtml": "<p>Major contributions：(1) prior scan to reduce false positive rate; (2) novel VSS loss to adjust sensitivity and precision; (3) dual models for human-AI interaction, high efficiency and robustness, fit well for clinical practice.</p>"
    },
    "zh": {
      "title": "脑转移瘤检测与分割",
      "descriptionHtml": "<p>主要贡献：（1）利用既往扫描降低假阳性率；（2）提出新的 VSS 损失函数，以调节灵敏度与精确率；（3）采用双模型实现人机交互，兼顾效率与稳健性，契合临床实践需求。</p>"
    }
  },
  {
    "id": "research-2",
    "images": [
      {
        "url": "https://pkuaimi.com/wp-content/uploads/2025/11/FOV-extension.png"
      }
    ],
    "en": {
      "title": "Deep learning CBCT FOV extension for adaptive radiotherapy",
      "descriptionHtml": ""
    },
    "zh": {
      "title": "面向自适应放疗的深度学习 CBCT 视野扩增",
      "descriptionHtml": ""
    }
  },
  {
    "id": "research-3",
    "images": [
      {
        "url": "https://pkuaimi.com/wp-content/uploads/2025/11/GraphicalAbstract2.png"
      }
    ],
    "en": {
      "title": "Deep Learning for Perspective Deformation Correction in Cone-Beam Computed Tomography",
      "descriptionHtml": ""
    },
    "zh": {
      "title": "锥形束 CT 透视变形校正的深度学习方法",
      "descriptionHtml": ""
    }
  },
  {
    "id": "research-4",
    "images": [
      {
        "url": "https://pkuaimi.com/wp-content/uploads/2025/11/LLMDecisionSupport.png"
      }
    ],
    "en": {
      "title": "LLM-based decision support for radiation oncology",
      "descriptionHtml": ""
    },
    "zh": {
      "title": "基于大语言模型的放射肿瘤学决策支持",
      "descriptionHtml": ""
    }
  }
]
